{
  "_meta": {
    "specVersion": "0.2.0",
    "manifestSha256": "6f204b7f139fcdfea9144b84c5c226d45a6e1e38fe8cd09763473b43d3f3e6fb",
    "description": "crystallize(events-feed, viewer=admin). Feed архетип; v0.2.0: добавлен itemDisplay (primary=title, secondary=startsAt из FieldsOrder)."
  },
  "projectionId": "events-feed",
  "archetype": "feed",
  "viewer": "admin",
  "slots": {
    "body": {
      "entries": [
        { "id": "e1", "title": "Quarterly Planning", "organizerId": "u-org-1", "venueId": "v1", "startsAt": "2026-05-01T14:00:00.000Z", "endsAt": "2026-05-01T16:00:00.000Z", "status": "draft" }
      ],
      "itemDisplay": { "primary": "title", "secondary": "startsAt" }
    }
  }
}
