{
  "_meta": {
    "specVersion": "0.1",
    "manifestSha256": "6f204b7f139fcdfea9144b84c5c226d45a6e1e38fe8cd09763473b43d3f3e6fb",
    "description": "crystallize(book-detail, viewer=librarian). Detail для b1. Librarian доступны remove (destructive) и update (standard); borrow_book в canExecute librarian'а нет."
  },
  "projectionId": "book-detail",
  "archetype": "detail",
  "viewer": "librarian",
  "slots": {
    "header": {
      "title": "The Pragmatic Programmer"
    },
    "body": {
      "fields": [
        { "name": "id",     "value": "b1" },
        { "name": "title",  "value": "The Pragmatic Programmer" },
        { "name": "author", "value": "Hunt & Thomas" },
        { "name": "isbn",   "value": "978-0201616224" }
      ]
    },
    "footer": {
      "actions": [
        { "intentId": "remove_book", "label": "remove_book", "confirmation": "destructive" },
        { "intentId": "update_book_metadata", "label": "update_book_metadata", "confirmation": "standard" }
      ]
    }
  }
}
