{
  "_meta": {
    "specVersion": "0.2.0",
    "manifestSha256": "6f204b7f139fcdfea9144b84c5c226d45a6e1e38fe8cd09763473b43d3f3e6fb",
    "description": "crystallize(events-feed, attendee Alice). attendee не видит чужие Event (B-1) → пустой entries. itemDisplay derive'нут из ontology независимо от viewer."
  },
  "projectionId": "events-feed",
  "archetype": "feed",
  "viewer": "attendee",
  "slots": {
    "body": {
      "entries": [],
      "itemDisplay": { "primary": "title", "secondary": "startsAt" }
    }
  }
}
