{
  "_meta": {
    "specVersion": "0.1",
    "manifestSha256": "6f204b7f139fcdfea9144b84c5c226d45a6e1e38fe8cd09763473b43d3f3e6fb",
    "description": "crystallize(event-detail, viewer=organizer). organizer доступны 3 intents (cancel_event, edit_event, invite_user); accept_invite/decline_invite — attendee-only."
  },
  "projectionId": "event-detail",
  "archetype": "detail",
  "viewer": "organizer",
  "slots": {
    "header": {
      "title": "Quarterly Planning"
    },
    "body": {
      "fields": [
        { "name": "id",          "value": "e1" },
        { "name": "title",       "value": "Quarterly Planning" },
        { "name": "organizerId", "value": "u-org-1" },
        { "name": "venueId",     "value": "v1" },
        { "name": "startsAt",    "value": "2026-05-01T14:00:00.000Z" },
        { "name": "endsAt",      "value": "2026-05-01T16:00:00.000Z" },
        { "name": "status",      "value": "draft" }
      ]
    },
    "footer": {
      "actions": [
        { "intentId": "cancel_event", "label": "cancel_event", "confirmation": "standard" },
        { "intentId": "edit_event",   "label": "edit_event",   "confirmation": "standard" },
        { "intentId": "invite_user",  "label": "invite_user",  "confirmation": "standard" }
      ]
    }
  }
}
