{
  "_meta": {
    "specVersion": "0.1",
    "manifestSha256": "6f204b7f139fcdfea9144b84c5c226d45a6e1e38fe8cd09763473b43d3f3e6fb",
    "description": "crystallize(book-detail, viewer=reader-u-r1). Detail для записи b1 (первая по id ASC). Reader доступен только borrow_book (update/remove не в canExecute)."
  },
  "projectionId": "book-detail",
  "archetype": "detail",
  "viewer": "reader",
  "slots": {
    "header": {
      "title": "The Pragmatic Programmer"
    },
    "body": {
      "fields": [
        { "name": "id",     "value": "b1" },
        { "name": "title",  "value": "The Pragmatic Programmer" },
        { "name": "author", "value": "Hunt & Thomas" },
        { "name": "isbn",   "value": "978-0201616224" }
      ]
    },
    "footer": {
      "actions": [
        { "intentId": "borrow_book", "label": "borrow_book", "confirmation": "standard" }
      ]
    }
  }
}
