{
  "_meta": {
    "specVersion": "0.1",
    "manifestSha256": "6f204b7f139fcdfea9144b84c5c226d45a6e1e38fe8cd09763473b43d3f3e6fb",
    "description": "crystallize(librarian-dashboard, viewer=librarian). Dashboard archetype: body.sections пуст в v0.1 (composition Reserved L4); toolbar.actions содержит все intent'ы проекции, доступные librarian'у, упорядочены по intent.id ASC."
  },
  "projectionId": "librarian-dashboard",
  "archetype": "dashboard",
  "viewer": "librarian",
  "slots": {
    "header": {
      "title": "librarian-dashboard"
    },
    "body": {
      "sections": []
    },
    "toolbar": {
      "actions": [
        { "intentId": "add_book",      "label": "add_book",      "confirmation": "standard" },
        { "intentId": "cancel_loan",   "label": "cancel_loan",   "confirmation": "destructive" },
        { "intentId": "register_user", "label": "register_user", "confirmation": "standard" }
      ]
    }
  }
}
