{
  "_meta": {
    "specVersion": "0.1",
    "manifestSha256": "6f204b7f139fcdfea9144b84c5c226d45a6e1e38fe8cd09763473b43d3f3e6fb",
    "description": "crystallize(book-catalog, viewer=reader-u-r1, viewerWorld=bootstrap-as-reader-u-r1). Reader видит каталог; canExecute не содержит add/remove/update_book_metadata, поэтому actions пусты и toolbar.create отсутствует."
  },
  "projectionId": "book-catalog",
  "archetype": "catalog",
  "viewer": "reader",
  "slots": {
    "header": {
      "title": "Book"
    },
    "body": {
      "items": [
        { "id": "b1", "title": "The Pragmatic Programmer", "author": "Hunt & Thomas", "isbn": "978-0201616224" },
        { "id": "b2", "title": "Domain-Driven Design", "author": "Eric Evans", "isbn": "978-0321125217" },
        { "id": "b3", "title": "Designing Data-Intensive Applications", "author": "Martin Kleppmann" }
      ],
      "itemDisplay": { "primary": "title", "secondary": "author" }
    },
    "footer": { "actions": [] },
    "toolbar": {}
  }
}
