{
  "_meta": {
    "specVersion": "0.1",
    "manifestSha256": "6f204b7f139fcdfea9144b84c5c226d45a6e1e38fe8cd09763473b43d3f3e6fb",
    "description": "crystallize(my-loans, viewer=reader-u-r2). Bob не имеет своих Loan (viewerWorld.Loan пуст), но action return_book доступен (canExecute) — actions в catalog footer глобальны для проекции, не per-item."
  },
  "projectionId": "my-loans",
  "archetype": "catalog",
  "viewer": "reader",
  "slots": {
    "header": {
      "title": "Loan"
    },
    "body": {
      "items": [],
      "itemDisplay": { "primary": "status", "secondary": "borrowedAt" }
    },
    "footer": {
      "actions": [
        { "intentId": "return_book", "label": "return_book", "confirmation": "standard" }
      ]
    },
    "toolbar": {}
  }
}
